{"$schema":"http://json-schema.org/draft-04/schema#","type":"object","required":["orderId","orderDate","customer","items","shippingAddress","paymentMethod","currency","totalAmount"],"properties":{"orderId":{"type":"string","pattern":"^ORD-[0-9]{4}-[0-9]{1,15}$","maxLength":30},"orderDate":{"type":"string","format":"date-time"},"customer":{"type":"object","required":["customerId","name","email"],"properties":{"customerId":{"type":"string","minLength":1,"maxLength":20},"name":{"type":"string","minLength":1,"maxLength":100},"email":{"type":"string","format":"email","maxLength":150},"phone":{"type":"string","maxLength":20}}},"items":{"type":"array","minItems":1,"maxItems":50,"items":{"type":"object","required":["productId","quantity","unitPrice"],"properties":{"productId":{"type":"string","minLength":1,"maxLength":20},"productName":{"type":"string","maxLength":150},"quantity":{"type":"integer","minimum":1,"maximum":1000},"unitPrice":{"type":"number","minimum":0.01,"maximum":1000000}}}},"shippingAddress":{"type":"object","required":["addressLine1","city","state","postalCode","country"],"properties":{"addressLine1":{"type":"string","maxLength":200},"city":{"type":"string","maxLength":60},"state":{"type":"string","maxLength":60},"postalCode":{"type":"string","maxLength":12},"country":{"type":"string","maxLength":60}}},"paymentMethod":{"type":"string","enum":["CARD","UPI","NETBANKING","COD"]},"currency":{"type":"string","pattern":"^[A-Z]{3}$"},"totalAmount":{"type":"number","minimum":0.01,"maximum":100000000}}}
