{
  "orderId": "ORD-2026-1001",
  "orderDate": "2026-09-11T10:30:00+05:30",
  "customer": {"customerId": "CUST-501", "name": "Arun Kumar", "email": "arun.kumar@example.com", "phone": "+91-9876543210"},
  "items": [
    {"productId": "PROD-101", "productName": "Wireless Keyboard", "quantity": 2, "unitPrice": 1499.00},
    {"productId": "PROD-205", "productName": "USB-C Mouse", "quantity": 1, "unitPrice": 799.00}
  ],
  "shippingAddress": {"addressLine1": "21 Anna Salai", "city": "Chennai", "state": "Tamil Nadu", "postalCode": "600002", "country": "India"},
  "paymentMethod": "CARD",
  "currency": "INR",
  "totalAmount": 3797.00
}
